pub_date	title	venue	excerpt	citation	url_slug	paper_url	bibtex_url
2025-05-01	Air Leak Detection Using Sobel-Enhanced YOLO Algorithm from Infrared Images	2025 IEEE International Symposium on Circuits and Systems (ISCAS)		"Rong, Shuaiang and Hamdan, Emadeldeen and Khaleghi, Hamed and Karatas, Aslihan and Cetin, Ahmet Enis. (2025). ""Air Leak Detection Using Sobel-Enhanced YOLO Algorithm from Infrared Images."" <i>2025 IEEE International Symposium on Circuits and Systems (ISCAS)</i>."	air-leak-detection-using-sobel-enhanced-yolo-algorithm-from-infrared-images	http://academicpages.github.io/files/paper1.pdf	http://academicpages.github.io/files/proceedings.bib
2024-04-01	Electroencephalogram Sensor Data Compression Using an Asymmetrical Sparse Autoencoder with a Discrete Cosine Transform Layer	ICASSP 2024 - 2024 IEEE International Conference on Acoustics, Speech and Signal Processing (ICASSP)		"Zhu, Xin and Pan, Hongyi and Rong, Shuaiang and Cetin, Ahmet Enis. (2024). ""Electroencephalogram Sensor Data Compression Using an Asymmetrical Sparse Autoencoder with a Discrete Cosine Transform Layer."" <i>ICASSP 2024 - 2024 IEEE International Conference on Acoustics, Speech and Signal Processing (ICASSP)</i>."	electroencephalogram-sensor-data-compression-using-an-asymmetrical-sparse-autoencoder-with-a-discrete-cosine-transform-layer	http://academicpages.github.io/files/paper2.pdf	http://academicpages.github.io/files/proceedings.bib
2022-07-01	Performance of Grid-forming Control of Grid-edge DERs in Distribution Grids	2022 IEEE Power &amp; Energy Society General Meeting (PESGM)		"Yu, Shiwen and Rong, Shuaiang and He, Lina. (2022). ""Performance of Grid-forming Control of Grid-edge DERs in Distribution Grids."" <i>2022 IEEE Power &amp; Energy Society General Meeting (PESGM)</i>."	performance-of-grid-forming-control-of-grid-edge-ders-in-distribution-grids	http://academicpages.github.io/files/paper3.pdf	http://academicpages.github.io/files/proceedings.bib
2020-10-01	An Intelligent Overcurrent Protection Algorithm of Distribution Systems with Inverter based Distributed Energy Resources	2020 IEEE Energy Conversion Congress and Exposition (ECCE)		"He, Lina and Rong, Shuaiang and Liu, Chengwei. (2020). ""An Intelligent Overcurrent Protection Algorithm of Distribution Systems with Inverter based Distributed Energy Resources."" <i>2020 IEEE Energy Conversion Congress and Exposition (ECCE)</i>."	an-intelligent-overcurrent-protection-algorithm-of-distribution-systems-with-inverter-based-distributed-energy-resources	http://academicpages.github.io/files/paper4.pdf	http://academicpages.github.io/files/proceedings.bib
2020-08-01	A Joint Faster RCNN and Stereovision Algorithm for Vegetation Encroachment Detection in Power Line Corridors	2020 IEEE Power &amp; Energy Society General Meeting (PESGM)		"Rong, Shuaiang and He, Lina. (2020). ""A Joint Faster RCNN and Stereovision Algorithm for Vegetation Encroachment Detection in Power Line Corridors."" <i>2020 IEEE Power &amp; Energy Society General Meeting (PESGM)</i>."	a-joint-faster-rcnn-and-stereovision-algorithm-for-vegetation-encroachment-detection-in-power-line-corridors	http://academicpages.github.io/files/paper5.pdf	http://academicpages.github.io/files/proceedings.bib
2016-09-01	Research on monitoring device for indicating external damage risk of overhead line based on image recognition technology with binocular vision cameras	2016 International Conference on Condition Monitoring and Diagnosis (CMD)		"Yang Fu and Shuai-ang Rong and Wen-bin Zhao and Hao Shen. (2016). ""Research on monitoring device for indicating external damage risk of overhead line based on image recognition technology with binocular vision cameras."" <i>2016 International Conference on Condition Monitoring and Diagnosis (CMD)</i>."	research-on-monitoring-device-for-indicating-external-damage-risk-of-overhead-line-based-on-image-recognition-technology-with-binocular-vision-cameras	http://academicpages.github.io/files/paper6.pdf	http://academicpages.github.io/files/proceedings.bib
2016-09-01	The image study of partial discharge location by acoustic measurement	2016 International Conference on Condition Monitoring and Diagnosis (CMD)		"Ma Ao and Dong Ming and Rong Shuaiang. (2016). ""The image study of partial discharge location by acoustic measurement."" <i>2016 International Conference on Condition Monitoring and Diagnosis (CMD)</i>."	the-image-study-of-partial-discharge-location-by-acoustic-measurement	http://academicpages.github.io/files/paper7.pdf	http://academicpages.github.io/files/proceedings.bib
2016-09-01	Unified dynamic rate system of generation and transmission based on technology of condition monitoring for overhead transmission line	2016 International Conference on Condition Monitoring and Diagnosis (CMD)		"Zhao, W. B. and Rong, S. A. and Yu, Q. G. and Zhang, X. G. and Xuan, D. H. and Sun, W. Z and Cao, L.. (2016). ""Unified dynamic rate system of generation and transmission based on technology of condition monitoring for overhead transmission line."" <i>2016 International Conference on Condition Monitoring and Diagnosis (CMD)</i>."	unified-dynamic-rate-system-of-generation-and-transmission-based-on-technology-of-condition-monitoring-for-overhead-transmission-line	http://academicpages.github.io/files/paper8.pdf	http://academicpages.github.io/files/proceedings.bib
