pub_date	title	venue	excerpt	citation	url_slug	paper_url	bibtex_url
2025-08-01	Advanced YOLO-Based Real-Time Power Line Detection for Vegetation Management	IEEE Transactions on Power Delivery		"Rong, Shuaiang and He, Lina and Atici, Salih Furkan and Cetin, Ahmet Enis. (2025). ""Advanced YOLO-Based Real-Time Power Line Detection for Vegetation Management."" <i>IEEE Transactions on Power Delivery</i>."	advanced-yolo-based-real-time-power-line-detection-for-vegetation-management	http://academicpages.github.io/files/paper1.pdf	http://academicpages.github.io/files/pubs.bib
2025-04-01	Multi-resolution training improves robustness against adversarial attacks	Signal, Image and Video Processing		"Rong, Shuaiang and Hamdan, Emadeldeen and Cetin, Ahmet Enis. (2025). ""Multi-resolution training improves robustness against adversarial attacks."" <i>Signal, Image and Video Processing</i>."	multi-resolution-training-improves-robustness-against-adversarial-attacks	http://academicpages.github.io/files/paper2.pdf	http://academicpages.github.io/files/pubs.bib
2022-12-01	Intelligent height measurement technology for ground encroachments in large‐scale power transmission corridor based on advanced binocular stereovision algorithms	IET Generation, Transmission &amp; Distribution		"Tang, Zhong and Jia, Chenglong and Wang, Heng and Rong, Shuaiang and Zhao, Wenbin. (2022). ""Intelligent height measurement technology for ground encroachments in large‐scale power transmission corridor based on advanced binocular stereovision algorithms."" <i>IET Generation, Transmission &amp; Distribution</i>."	intelligent-height-measurement-technology-for-ground-encroachments-in-large-scale-power-transmission-corridor-based-on-advanced-binocular-stereovision-algorithms	http://academicpages.github.io/files/paper3.pdf	http://academicpages.github.io/files/pubs.bib
2021-12-01	Intelligent Detection of Vegetation Encroachment of Power Lines With Advanced Stereovision	IEEE Transactions on Power Delivery		"Rong, Shuaiang and He, Lina and Du, Liang and Li, Zuyi and Yu, Shiwen. (2021). ""Intelligent Detection of Vegetation Encroachment of Power Lines With Advanced Stereovision."" <i>IEEE Transactions on Power Delivery</i>."	intelligent-detection-of-vegetation-encroachment-of-power-lines-with-advanced-stereovision	http://academicpages.github.io/files/paper4.pdf	http://academicpages.github.io/files/pubs.bib
2021-01-01	Impact of Photovoltaic Generation Integration on Protection of Distribution Systems			"Rong, Shuaiang and He, Lina. (2021). ""Impact of Photovoltaic Generation Integration on Protection of Distribution Systems."" <i></i>."	impact-of-photovoltaic-generation-integration-on-protection-of-distribution-systems	http://academicpages.github.io/files/paper5.pdf	http://academicpages.github.io/files/pubs.bib
2018-11-01	Probabilistic Load Flow Method Based on Modified Latin Hypercube-Important Sampling	Energies		"Li, Quan and Wang, Xin and Rong, Shuaiang. (2018). ""Probabilistic Load Flow Method Based on Modified Latin Hypercube-Important Sampling."" <i>Energies</i>."	probabilistic-load-flow-method-based-on-modified-latin-hypercube-important-sampling	http://academicpages.github.io/files/paper6.pdf	http://academicpages.github.io/files/pubs.bib
